post_title,positive_rate,comment_count,avg_comment_score
"32F, dry skin, product recommendations",62.5,8,1.38
Advice on what to purchase,50.0,2,0.5
Best Korean day moisturisers of 2025?,75.0,4,2.5
DRY EXTREMELY SENSITIVE skin I’m looking to enter Korean Skincare,69.23,13,1.23
De-influencing you,21.74,23,3.87
Desperate to find a foundation/covering cream,100.0,2,1.0
Do people really care about packaging when choosing skincare products?,40.0,5,1.8
Experiences with Spicules,50.0,2,2.0
"For winter skincare, how do you do your routine?",0.0,1,1.0
Help needed in skincare/kbeauty,37.5,8,1.75
Help with oily skin skincare routine,100.0,1,1.0
Is it worth it to buy skincare directly from KR than trusted online shops?,40.0,5,3.4
Kbeauty body care suggestions,68.75,16,1.81
Korean beauty help needed,0.0,1,3.0
My Minimum Skincare Routine That Finally Helped My Acne-Prone Skin,20.0,5,1.4
My algorithm completely taken over by K skincare,46.67,15,1.13
Please help me :(,50.0,2,1.0
Question to those who made US Orders from Olive Young,50.0,2,1.0
Skincare in Myeongdong - Dear Klairs,50.0,2,1.0
What’s the one thing you’d definitely want to buy in Korea?,41.38,29,2.34
Why is korean products so expensive? :(,17.65,17,7.82
has anyone else tried ginseng skincare? kinda surprised it actually works??,80.0,10,2.5
skincare haul & question,58.33,12,2.25
went on a huge makeup and skincare haul!!,22.22,18,1.39
