comment_id,video_id,author,text,like_count,published_at,reply_count,video_title,video_channel,video_url
UgxQsX32OKpf3LPHo0l4AaABAg,wsB0opxgIFI,@MohammedAmeer-r5l,So cute,0,2025-09-06T09:49:38Z,0,YesStyle Haul💖 #kbeauty #makeup #unboxing #haul #clio #wonyoungism #peripera #dasique #shorts #fyp,Dear_diarlee,https://www.youtube.com/watch?v=wsB0opxgIFI
UgxxZ72KTdf0XLFWIB14AaABAg,wsB0opxgIFI,@StrxberriiCore,The cattt on the clio palette it’s jussttttt sooo cuteee and also congrats you are almost at 16k!!!!!!,2,2025-06-12T11:24:14Z,2,YesStyle Haul💖 #kbeauty #makeup #unboxing #haul #clio #wonyoungism #peripera #dasique #shorts #fyp,Dear_diarlee,https://www.youtube.com/watch?v=wsB0opxgIFI
UgybwWqTUgMxddMV92d4AaABAg,wsB0opxgIFI,@niiha2510,Sooo cuteee,0,2025-09-25T10:19:50Z,1,YesStyle Haul💖 #kbeauty #makeup #unboxing #haul #clio #wonyoungism #peripera #dasique #shorts #fyp,Dear_diarlee,https://www.youtube.com/watch?v=wsB0opxgIFI
UgzinxnKBho_zJL5rQt4AaABAg,wsB0opxgIFI,@Alo-y6w2x,Building my fyp 💕🎀🍥,1,2025-06-12T12:41:39Z,0,YesStyle Haul💖 #kbeauty #makeup #unboxing #haul #clio #wonyoungism #peripera #dasique #shorts #fyp,Dear_diarlee,https://www.youtube.com/watch?v=wsB0opxgIFI
Ugyod3tsI6c1oHpfXkR4AaABAg,wsB0opxgIFI,@dewyribbon,so aesthetic omggg,0,2025-07-29T14:50:12Z,0,YesStyle Haul💖 #kbeauty #makeup #unboxing #haul #clio #wonyoungism #peripera #dasique #shorts #fyp,Dear_diarlee,https://www.youtube.com/watch?v=wsB0opxgIFI
Ugz2Yk5QeUD53NTdeJ94AaABAg,wsB0opxgIFI,@HanJisung-y2f,I love pink so much🎀🩷🫧,0,2025-06-27T14:29:09Z,0,YesStyle Haul💖 #kbeauty #makeup #unboxing #haul #clio #wonyoungism #peripera #dasique #shorts #fyp,Dear_diarlee,https://www.youtube.com/watch?v=wsB0opxgIFI
UgyiMS5YVyJn8VsryBt4AaABAg,wsB0opxgIFI,@rajwindersingh798,Ur nails are so cutteeeee :3!! Are they  press ons?,1,2025-06-10T19:00:18Z,3,YesStyle Haul💖 #kbeauty #makeup #unboxing #haul #clio #wonyoungism #peripera #dasique #shorts #fyp,Dear_diarlee,https://www.youtube.com/watch?v=wsB0opxgIFI
Ugw7j0OCywlp4Nt-m_d4AaABAg,wsB0opxgIFI,@lowkey_livvyy,Finally someone who admits that it’s a huge haul bc most influencers say “mini haul”,3,2025-06-22T03:13:08Z,1,YesStyle Haul💖 #kbeauty #makeup #unboxing #haul #clio #wonyoungism #peripera #dasique #shorts #fyp,Dear_diarlee,https://www.youtube.com/watch?v=wsB0opxgIFI
UgziREj6daalfozVtdp4AaABAg,wsB0opxgIFI,@nvm_shelly,Cleaning ny fyp 5/100 <33,0,2025-11-01T18:13:52Z,0,YesStyle Haul💖 #kbeauty #makeup #unboxing #haul #clio #wonyoungism #peripera #dasique #shorts #fyp,Dear_diarlee,https://www.youtube.com/watch?v=wsB0opxgIFI
UgyQZOGLltVbuLZ_JiJ4AaABAg,wsB0opxgIFI,@sticaiser,Cleaning my fyp 💮🥟🌸🍥,0,2025-11-01T19:19:25Z,0,YesStyle Haul💖 #kbeauty #makeup #unboxing #haul #clio #wonyoungism #peripera #dasique #shorts #fyp,Dear_diarlee,https://www.youtube.com/watch?v=wsB0opxgIFI
UgwrlOq-e6Z3GfJqgMF4AaABAg,wsB0opxgIFI,@yoonahtips143,building my fyp 13/30 🍥🐚,2,2025-06-11T22:34:34Z,0,YesStyle Haul💖 #kbeauty #makeup #unboxing #haul #clio #wonyoungism #peripera #dasique #shorts #fyp,Dear_diarlee,https://www.youtube.com/watch?v=wsB0opxgIFI
UgyYdbIIASjggA-V1_V4AaABAg,wsB0opxgIFI,@angel_diva3545,I Think Ur obsessed with this song******🌸🌸🎀🎀,0,2025-06-30T09:00:39Z,1,YesStyle Haul💖 #kbeauty #makeup #unboxing #haul #clio #wonyoungism #peripera #dasique #shorts #fyp,Dear_diarlee,https://www.youtube.com/watch?v=wsB0opxgIFI
UgxXwQ8q-F05HN56CbV4AaABAg,wsB0opxgIFI,@BunnyKokoh,My dream life 💕✨,0,2025-08-20T19:55:30Z,1,YesStyle Haul💖 #kbeauty #makeup #unboxing #haul #clio #wonyoungism #peripera #dasique #shorts #fyp,Dear_diarlee,https://www.youtube.com/watch?v=wsB0opxgIFI
Ugy-Q3sFMrZGO4yuZ094AaABAg,wsB0opxgIFI,@ruwanrasika4512,"Hi, can I know about the  app you use to edit your videos, please 😅
Also your lens too😊😊",2,2025-06-10T16:02:36Z,1,YesStyle Haul💖 #kbeauty #makeup #unboxing #haul #clio #wonyoungism #peripera #dasique #shorts #fyp,Dear_diarlee,https://www.youtube.com/watch?v=wsB0opxgIFI
UgwU1AhbGXsrhGpMey54AaABAg,wsB0opxgIFI,@z0mb13erawr,so cuteee💕,0,2025-06-18T11:30:39Z,1,YesStyle Haul💖 #kbeauty #makeup #unboxing #haul #clio #wonyoungism #peripera #dasique #shorts #fyp,Dear_diarlee,https://www.youtube.com/watch?v=wsB0opxgIFI
Ugy9aBNM2CqSbuoLBTR4AaABAg,wsB0opxgIFI,@TinaPearl143,Commenting to clean my fyp 2/100,3,2025-09-28T13:14:11Z,0,YesStyle Haul💖 #kbeauty #makeup #unboxing #haul #clio #wonyoungism #peripera #dasique #shorts #fyp,Dear_diarlee,https://www.youtube.com/watch?v=wsB0opxgIFI
UgwAW-LAIoH7HgWLVCJ4AaABAg,wsB0opxgIFI,@MandeepDua-v6b,Diarlee what's ure fav k lippie I'll buy that,2,2025-06-11T02:50:40Z,2,YesStyle Haul💖 #kbeauty #makeup #unboxing #haul #clio #wonyoungism #peripera #dasique #shorts #fyp,Dear_diarlee,https://www.youtube.com/watch?v=wsB0opxgIFI
UgwTMx8-oxGcTGdXBeh4AaABAg,48QReWnEPuc,@johnayala5551,"I'm on my 2nd bottle of The Rice Toner from ""I'm From"" and there's not a single day that I don't get compliments from people ...even from strangers. My skin is plumped, dewy & just immaculately flawless ❤",3391,2023-11-21T04:04:40Z,65,Viral K-Beauty Products That are Actually Worth Your Money #skincare #koreanskincare,Skin Cupid,https://www.youtube.com/watch?v=48QReWnEPuc
UgweMUPE7OWzSbC_35l4AaABAg,48QReWnEPuc,@selenasmith7943,The rice toner is wonderful! I usually switch up during seasons.  But instantly restocked 3 more when i ran out. Overall brightens and hydrating!,911,2023-11-24T04:40:00Z,9,Viral K-Beauty Products That are Actually Worth Your Money #skincare #koreanskincare,Skin Cupid,https://www.youtube.com/watch?v=48QReWnEPuc
UgwLjpXLC4SSg9CCPmB4AaABAg,48QReWnEPuc,@MISSME_UNSOLVED,The rice toner looks really good. I will be looking out for it. Thanks❤,2374,2023-09-27T17:46:14Z,14,Viral K-Beauty Products That are Actually Worth Your Money #skincare #koreanskincare,Skin Cupid,https://www.youtube.com/watch?v=48QReWnEPuc
Ugz2Fiw6T6hJks9ZXCd4AaABAg,48QReWnEPuc,@IsMeThatGirlMedeea,"Jihyo(twice) in the back: ""SO KILLIN' ME GOOD!😉""
(no hate)",11,2024-03-12T06:10:26Z,0,Viral K-Beauty Products That are Actually Worth Your Money #skincare #koreanskincare,Skin Cupid,https://www.youtube.com/watch?v=48QReWnEPuc
UgygJq-sYUcR1bN-1ft4AaABAg,48QReWnEPuc,@gracemabrey5230,"That cleansing oil is really good. I bought it on sale and though I’ve tried others such as Heimush much lauded cleansing balm, I keep going back to this one. It also has a citrus scent that I really like and is even better used with their manyo cleansing foam (but I’ve found I don’t need to on nights I’m very tired) if you like a two-step cleansing process. I can’t stop touching my skin as I can’t believe how clean it feels. But it’s not irritated or dry.",782,2023-09-27T20:48:58Z,23,Viral K-Beauty Products That are Actually Worth Your Money #skincare #koreanskincare,Skin Cupid,https://www.youtube.com/watch?v=48QReWnEPuc
UgwKxvxOsisewf3PjTB4AaABAg,48QReWnEPuc,@sezubgvwj,manyo cleansing oil was the first skincare product i spent this much money on and i've been using it ever since!! (for over a year) even after the first usage i saw major improvement and it LITERALLY CLEANSES ALL OF YOUR IMPURITIES and makes your skin feel sooo good 😭,124,2024-01-15T17:22:49Z,5,Viral K-Beauty Products That are Actually Worth Your Money #skincare #koreanskincare,Skin Cupid,https://www.youtube.com/watch?v=48QReWnEPuc
UgwOFTb7Yr5M4gaiYiB4AaABAg,48QReWnEPuc,@uzougwu1511,I have been using that rice toner for a year and  some months it's a must have. I am Nigerian so yes Korea skincare works for black people for any 1 wondering,61,2024-01-30T13:07:06Z,2,Viral K-Beauty Products That are Actually Worth Your Money #skincare #koreanskincare,Skin Cupid,https://www.youtube.com/watch?v=48QReWnEPuc
UgyOiTdwduYRwHyRAjt4AaABAg,48QReWnEPuc,@noorain5659,"I have the rice toner! Makes my skin shine and got the small one
You guys should really buy it!",20,2024-01-23T21:45:29Z,0,Viral K-Beauty Products That are Actually Worth Your Money #skincare #koreanskincare,Skin Cupid,https://www.youtube.com/watch?v=48QReWnEPuc
Ugy76OcC3Gx4QRQgtxh4AaABAg,48QReWnEPuc,@Bee0008,The rice toner is amazing. That was the first product I ever used that made my super dry skin so hydrated it almost made my skin an oily type of skin 😂,448,2023-11-23T19:45:03Z,11,Viral K-Beauty Products That are Actually Worth Your Money #skincare #koreanskincare,Skin Cupid,https://www.youtube.com/watch?v=48QReWnEPuc
UgybRIRZT_U6mMrNF1t4AaABAg,48QReWnEPuc,@clarewishart2738,The rice toner is amazing!,93,2023-09-27T21:23:40Z,0,Viral K-Beauty Products That are Actually Worth Your Money #skincare #koreanskincare,Skin Cupid,https://www.youtube.com/watch?v=48QReWnEPuc
UgyEKduQnrcwSxaC-6d4AaABAg,48QReWnEPuc,@Riya-qu1md,The cosrx snail muccin is also the best K-beauty product!!!! I love it!!,193,2023-11-18T09:43:41Z,4,Viral K-Beauty Products That are Actually Worth Your Money #skincare #koreanskincare,Skin Cupid,https://www.youtube.com/watch?v=48QReWnEPuc
UgwsbX38WcKCSdYZhPp4AaABAg,48QReWnEPuc,@zahrahahmed6845,I tried the rice toner randomly and is just gorgeous I’m definitely going to repurchase it and highly recommend it. It helped me a lot with my breakouts.,28,2023-10-27T19:08:20Z,0,Viral K-Beauty Products That are Actually Worth Your Money #skincare #koreanskincare,Skin Cupid,https://www.youtube.com/watch?v=48QReWnEPuc
Ugw9SDUsCcrdkWDhPs94AaABAg,48QReWnEPuc,@syazwanaaljunid2052,"The im fro rice toner broke me out and i have senstive oily acne prone skin 😪 but their mugwort essence and mask are my holy grail, reduces redness, balances my oil production and my skin is clearer using them.",228,2023-10-19T17:53:48Z,16,Viral K-Beauty Products That are Actually Worth Your Money #skincare #koreanskincare,Skin Cupid,https://www.youtube.com/watch?v=48QReWnEPuc
UgyBriD3kOCEKRB5xNd4AaABAg,48QReWnEPuc,@veruschkamunilall1595,Beauty of Joseon moisturising sunblock. I swear by it.,21,2023-10-26T08:05:03Z,1,Viral K-Beauty Products That are Actually Worth Your Money #skincare #koreanskincare,Skin Cupid,https://www.youtube.com/watch?v=48QReWnEPuc
UgxuotGNJvfQg7tQ68d4AaABAg,48QReWnEPuc,@trixie_pixie,The rice toner is my holy grail ❤,392,2023-10-01T07:13:38Z,15,Viral K-Beauty Products That are Actually Worth Your Money #skincare #koreanskincare,Skin Cupid,https://www.youtube.com/watch?v=48QReWnEPuc
UgwfF7dOa0SiLZQe35h4AaABAg,48QReWnEPuc,@sb2333,It would be helpful if you can include the type of skin your products are suitable for.,558,2023-11-09T20:15:53Z,14,Viral K-Beauty Products That are Actually Worth Your Money #skincare #koreanskincare,Skin Cupid,https://www.youtube.com/watch?v=48QReWnEPuc
UgyFOiBhfZA0PEgfNB54AaABAg,48QReWnEPuc,@MsLinzoo,I love that rice toner!!  ❤ it’s so good!!❤,4,2024-02-23T17:49:21Z,0,Viral K-Beauty Products That are Actually Worth Your Money #skincare #koreanskincare,Skin Cupid,https://www.youtube.com/watch?v=48QReWnEPuc
UgwPDo0DhCmW38S2inl4AaABAg,48QReWnEPuc,@dhanashri5661,That Oil Cleanser is Killing Me Good ❤,18,2023-12-07T10:31:11Z,0,Viral K-Beauty Products That are Actually Worth Your Money #skincare #koreanskincare,Skin Cupid,https://www.youtube.com/watch?v=48QReWnEPuc
UgxqE3AOD7QN7JGSLPl4AaABAg,48QReWnEPuc,@naz_944,"Honestly, tried the manyo oil for about a month now and I keep going back to Banila Co cleansing balm. The oil feels amazing on my skin but doesn't take off waterproof mascara.",38,2023-10-18T18:06:41Z,4,Viral K-Beauty Products That are Actually Worth Your Money #skincare #koreanskincare,Skin Cupid,https://www.youtube.com/watch?v=48QReWnEPuc
UgxUhmdij4rYUysmnqh4AaABAg,48QReWnEPuc,@thisiscouplegoals,I LOOOVE how the Rice toner makes my face looks and I’ve only used it for 3 days! I’m going to use that product forever ! 🥰,1,2024-10-07T19:16:56Z,0,Viral K-Beauty Products That are Actually Worth Your Money #skincare #koreanskincare,Skin Cupid,https://www.youtube.com/watch?v=48QReWnEPuc
Ugw_5nExymq4EVmE3Rt4AaABAg,48QReWnEPuc,@FIONA21ful,"Numbuzzin eazy peasy oil cleanser is fab for eye removal , takes off everything and does not leave eyes sore .  Its the only oily remover ive ever been able to use.",1,2023-10-23T00:53:08Z,0,Viral K-Beauty Products That are Actually Worth Your Money #skincare #koreanskincare,Skin Cupid,https://www.youtube.com/watch?v=48QReWnEPuc
Ugxf5lzKbx5e0XTLZzZ4AaABAg,48QReWnEPuc,@ueki0078,Thanks for using Jihyo's song ❤,15,2023-12-08T02:22:04Z,0,Viral K-Beauty Products That are Actually Worth Your Money #skincare #koreanskincare,Skin Cupid,https://www.youtube.com/watch?v=48QReWnEPuc
Ugz3DyTXbp4QLlLnJnx4AaABAg,48QReWnEPuc,@anindita_1.7,rice toner is the best for indian winter dry skin ppl.,3,2023-10-24T08:14:05Z,0,Viral K-Beauty Products That are Actually Worth Your Money #skincare #koreanskincare,Skin Cupid,https://www.youtube.com/watch?v=48QReWnEPuc
UgwU5-LHXRoejGbQECt4AaABAg,48QReWnEPuc,@delishme2,"My suggestion would be ElizaVecca Hellpore Hyaluronic acid for the Korean win. It may not be viral, but it should be. I use really good and expensive skin care, which i love, but this little product gives a big bang for its cheap cost. Best hack though, apply hyaluronic acid to WET skin to get the best moisture lock in properties from it. Cute packaging too.",0,2024-02-18T22:53:07Z,0,Viral K-Beauty Products That are Actually Worth Your Money #skincare #koreanskincare,Skin Cupid,https://www.youtube.com/watch?v=48QReWnEPuc
UgwyKHAB0ZGvUfEAPxF4AaABAg,48QReWnEPuc,@sumlem,"Thanks for showing the ingredients! I can't use these because of fragrance and botanical extracts, but it looks like people love these",8,2023-10-27T01:27:59Z,0,Viral K-Beauty Products That are Actually Worth Your Money #skincare #koreanskincare,Skin Cupid,https://www.youtube.com/watch?v=48QReWnEPuc
UgxQzBkHbbllfCzTwE14AaABAg,48QReWnEPuc,@Bahiya13,The rice toner is everything! Ive been ising it for about a year and trust me she isnt lying!,11,2023-10-21T16:07:12Z,3,Viral K-Beauty Products That are Actually Worth Your Money #skincare #koreanskincare,Skin Cupid,https://www.youtube.com/watch?v=48QReWnEPuc
UgwWVxdDVSS8knIreWd4AaABAg,48QReWnEPuc,@paradis3ra,"The rice toner gives my skin a very dewy look and makes my face look so healthy & glowy. I love love love the toner, but after a few times usage, my skin started getting irritated, so sadly i had to stop using it 😢",3,2023-12-05T08:14:36Z,1,Viral K-Beauty Products That are Actually Worth Your Money #skincare #koreanskincare,Skin Cupid,https://www.youtube.com/watch?v=48QReWnEPuc
UgzsMMCLs4WHR-ipPEl4AaABAg,48QReWnEPuc,@Bunny.blaster,rice toner saved my complexion on my third bottle now,3,2024-03-17T02:04:02Z,0,Viral K-Beauty Products That are Actually Worth Your Money #skincare #koreanskincare,Skin Cupid,https://www.youtube.com/watch?v=48QReWnEPuc
UgzgbNM9nTffiM0VRml4AaABAg,48QReWnEPuc,@NatalieG427,"I’m in my early 60’s. As we get older, our dry skin needs a toner with more viscosity. I’m still loving the Haruharu fermented Rice toner & another one that is under rated is the 9Wishes toner.",0,2025-11-02T17:24:44Z,0,Viral K-Beauty Products That are Actually Worth Your Money #skincare #koreanskincare,Skin Cupid,https://www.youtube.com/watch?v=48QReWnEPuc
Ugw7aQOQTpYQ2HDUiEN4AaABAg,48QReWnEPuc,@Cute-t8z5y,I am using simple rose water as toner and almond oil as clearnser of makeup. So this two products are available in all over the world and not expensive and also very good on skin.My skin is so glowing and so clear. We are Indian girl loves this two products.,36,2023-11-26T09:03:49Z,1,Viral K-Beauty Products That are Actually Worth Your Money #skincare #koreanskincare,Skin Cupid,https://www.youtube.com/watch?v=48QReWnEPuc
UgyT_XjPDvC0xp6nJ714AaABAg,48QReWnEPuc,@MLA0686,The I’m From line is so underrated. Their vitamin fruit serum is AMAZING,1,2025-04-21T23:20:43Z,0,Viral K-Beauty Products That are Actually Worth Your Money #skincare #koreanskincare,Skin Cupid,https://www.youtube.com/watch?v=48QReWnEPuc
UgyMEbYxERTfrQOs9CR4AaABAg,48QReWnEPuc,@Gresaaa,"the Haru toner is the most deeply hydrating thing ive ever tried, I never got on with the rice wonder though felt like it irritated my skin. another k brand I love is slurp, the preparation b essence is a barrier repairing DREAM",0,2024-12-25T15:17:20Z,0,Viral K-Beauty Products That are Actually Worth Your Money #skincare #koreanskincare,Skin Cupid,https://www.youtube.com/watch?v=48QReWnEPuc
UgwyyrJJQHI2juNdIBF4AaABAg,48QReWnEPuc,@samusmal3335,So well-edited and peaceful! 💕 I’ve never felt this good in my skin —  *Whiteonskinwhitening Cream*  gave me permanent whitening and the glow of my dreams! 💎,16,2025-06-14T11:29:28Z,1,Viral K-Beauty Products That are Actually Worth Your Money #skincare #koreanskincare,Skin Cupid,https://www.youtube.com/watch?v=48QReWnEPuc
UgznfxxXDQbfzomCQdh4AaABAg,48QReWnEPuc,@nadineb2726,I'm from is a wonderful brand. I bought the entire line and I've noticed a great difference. I bought the cleansing oil after watching a video a few months ago that is also excellent. It only took like 7 days to arrive from South Korea I thought that was really cool.,0,2024-01-02T05:50:12Z,0,Viral K-Beauty Products That are Actually Worth Your Money #skincare #koreanskincare,Skin Cupid,https://www.youtube.com/watch?v=48QReWnEPuc
UgxDpFW2FgGYhmiYdfB4AaABAg,48QReWnEPuc,@graciachristy1812,I boight the cleansing oil because it was written no1 on ollive young when I visited Korea. But then it was not good at all. It doesn’t remove my make up well. I always use waterproof mascara when i do my makeup and it doesn’t remove at all. My lip cream also hardly removed. I feel disappointed as I don’t know when to use it.,1,2023-11-15T10:42:34Z,0,Viral K-Beauty Products That are Actually Worth Your Money #skincare #koreanskincare,Skin Cupid,https://www.youtube.com/watch?v=48QReWnEPuc
UgxC4aJF2soD0MSh3Vh4AaABAg,48QReWnEPuc,@yulianagonzalez2428,"I use the rice toner I on my 4 bottle 
“I’m from” every single day of my life my tip at how I use it is when I finish shower dry my face right after I apply the tone because is a fast way to absorb it when the pores are open before the fresh air hits your face.",1,2024-01-27T14:32:22Z,1,Viral K-Beauty Products That are Actually Worth Your Money #skincare #koreanskincare,Skin Cupid,https://www.youtube.com/watch?v=48QReWnEPuc
UgxCwV5ST1y5QbYgR-R4AaABAg,48QReWnEPuc,@mona8426,The rice toner is excellent 👌,7,2023-10-07T23:04:23Z,0,Viral K-Beauty Products That are Actually Worth Your Money #skincare #koreanskincare,Skin Cupid,https://www.youtube.com/watch?v=48QReWnEPuc
UgwznE0QI8M2xFbB5fV4AaABAg,48QReWnEPuc,@anshumishra1579,Deependra goyal sir is most calm cool and smart sharks❤❤,1,2024-02-06T13:43:02Z,0,Viral K-Beauty Products That are Actually Worth Your Money #skincare #koreanskincare,Skin Cupid,https://www.youtube.com/watch?v=48QReWnEPuc
UgxZRZQEZoOWxTLz50t4AaABAg,48QReWnEPuc,@itsjasaiira9787,Anua heartleaf cleansing oil and toner are the bestttt,1,2024-05-25T15:52:07Z,0,Viral K-Beauty Products That are Actually Worth Your Money #skincare #koreanskincare,Skin Cupid,https://www.youtube.com/watch?v=48QReWnEPuc
UgzZ7ze2qEfSOMEwcL54AaABAg,48QReWnEPuc,@EBabyy359,The Im From rice toner is holy grail status! it literally transformed my skin it used to be so dull & uneven now its plumped and brightened it helped with some texture also <3 i loved when it came in the glass bottle it felt so luxe nonetheless its formula is the same and its still amazing!~,14,2023-11-14T10:57:57Z,0,Viral K-Beauty Products That are Actually Worth Your Money #skincare #koreanskincare,Skin Cupid,https://www.youtube.com/watch?v=48QReWnEPuc
UgxJqe3SPylP86dxPNh4AaABAg,48QReWnEPuc,@chumfun,Another good toner is tirtir milk skin toner ❤,1,2023-12-28T05:33:09Z,0,Viral K-Beauty Products That are Actually Worth Your Money #skincare #koreanskincare,Skin Cupid,https://www.youtube.com/watch?v=48QReWnEPuc
Ugy1xTUfz8CJfSnh-4h4AaABAg,48QReWnEPuc,@Me_Rkive,Rice toner is OG for me love it using past 3 years❤,0,2025-09-07T00:05:36Z,0,Viral K-Beauty Products That are Actually Worth Your Money #skincare #koreanskincare,Skin Cupid,https://www.youtube.com/watch?v=48QReWnEPuc
UgxttpA0pjyYbSXLAE94AaABAg,48QReWnEPuc,@Muskan-ip3ix,well cleansing oil is sustainable for all skin type and toner for dry dull and rough skin type,0,2023-11-30T11:37:50Z,0,Viral K-Beauty Products That are Actually Worth Your Money #skincare #koreanskincare,Skin Cupid,https://www.youtube.com/watch?v=48QReWnEPuc
UgwSzlRtuG4kx3KU3xx4AaABAg,48QReWnEPuc,@ROSEEVENTING200,Your skin is flawless,2,2024-04-13T11:03:29Z,0,Viral K-Beauty Products That are Actually Worth Your Money #skincare #koreanskincare,Skin Cupid,https://www.youtube.com/watch?v=48QReWnEPuc
UgxG19M1-xDKvZUTObR4AaABAg,48QReWnEPuc,@theworldsmostforgottentown,"First product seemed promising until I saw the closeup of its ingredients list and saw multiple essential oils in its formulation. My skin would SUFFER.

 Forget irritation from the environmental factors, using that product is going to irritate your skin!

But the rice toner is actually a solid product that I've had the pleasure of using before and so I'd definitely recommend it",0,2025-08-20T21:17:57Z,0,Viral K-Beauty Products That are Actually Worth Your Money #skincare #koreanskincare,Skin Cupid,https://www.youtube.com/watch?v=48QReWnEPuc
UgzsD7GStOv9J7Iurfx4AaABAg,48QReWnEPuc,@authorfabu,"Recent reviews on Amazon state the formula has changed causing skin damage. Gonna try that website, thank you.",0,2025-08-22T04:09:56Z,0,Viral K-Beauty Products That are Actually Worth Your Money #skincare #koreanskincare,Skin Cupid,https://www.youtube.com/watch?v=48QReWnEPuc
Ugz8Vjn3IL2kW7SfeWZ4AaABAg,48QReWnEPuc,@ophelia-p4i,"i loved the manyo oil cleanser for makeup removal, but the blend of essential oils really break out my sensitive skin. so all sensitives girls and guys, beware. Its still a great wash off product.",27,2023-10-11T17:36:04Z,2,Viral K-Beauty Products That are Actually Worth Your Money #skincare #koreanskincare,Skin Cupid,https://www.youtube.com/watch?v=48QReWnEPuc
UgyJWE3eYWbrjJ5lJKt4AaABAg,48QReWnEPuc,@higherlovepriestess,Purito centella toner and recovery cream are life for dry skin.,1,2024-01-17T08:23:31Z,1,Viral K-Beauty Products That are Actually Worth Your Money #skincare #koreanskincare,Skin Cupid,https://www.youtube.com/watch?v=48QReWnEPuc
Ugwi1t03XvLagJhIYPJ4AaABAg,48QReWnEPuc,@syazlyana4205,the rice toner is only for dry skin! the white liquid means that it is mixed with some oil-based ingredients. those with oily/acne prone/ combi skin can use their mugwort essence,120,2023-10-23T12:25:59Z,12,Viral K-Beauty Products That are Actually Worth Your Money #skincare #koreanskincare,Skin Cupid,https://www.youtube.com/watch?v=48QReWnEPuc
UgzkMwkFGJzQzHM5gIN4AaABAg,48QReWnEPuc,@Me_Rkive,I am using this toner past two years evry day twice amd its amazing❤,0,2025-10-16T00:30:00Z,0,Viral K-Beauty Products That are Actually Worth Your Money #skincare #koreanskincare,Skin Cupid,https://www.youtube.com/watch?v=48QReWnEPuc
UgxG9grlZAkzpIsjeQ14AaABAg,vUblA8O08oQ,@PointofYu,"💕I’ll leave the links to both products in the Linktree on my profile.

🇰🇷Medicube-Collagen Night Wrapping Mask
https://www.yesstyle.com/en/medicube-collagen-night-wrapping-mask-75ml/info.html/pid.1124066780?rco=POYU0330&utm_term=POYU0330&utm_medium=Influencer&mcg=influencer

🇯🇵BCL-Momo Puri Peach Fresh Pack Mask
https://www.yesstyle.com/en/bcl-momo-puri-peach-fresh-pack-mask-12g/info.html/pid.1120756149?rco=POYU0330&utm_term=POYU0330&utm_medium=Influencer&mcg=influencer",36,2025-10-02T14:17:39Z,0,K-Beauty vs J-Beauty : I Tried Their Viral Peel-off Mask,Point of Yu,https://www.youtube.com/watch?v=vUblA8O08oQ
UgwUzd3n-72QNs9RxRN4AaABAg,vUblA8O08oQ,@TheDuolingoCommenter,"I have the Japanese one! It's great if you don't have sensitive skin, it makes your skin smell very nice for a while.",312,2025-10-02T14:14:04Z,3,K-Beauty vs J-Beauty : I Tried Their Viral Peel-off Mask,Point of Yu,https://www.youtube.com/watch?v=vUblA8O08oQ
UgyM63lzKXTSwJ0uJxZ4AaABAg,vUblA8O08oQ,@yyhhyaa11100,I have the japanese one and its really good for my skin i love it,57,2025-10-03T04:36:15Z,3,K-Beauty vs J-Beauty : I Tried Their Viral Peel-off Mask,Point of Yu,https://www.youtube.com/watch?v=vUblA8O08oQ
UgwG_Xl5s_AXxzdHuUF4AaABAg,vUblA8O08oQ,@Smiling_Evoker,Why no one compare the price ?!,22,2025-10-10T11:52:46Z,0,K-Beauty vs J-Beauty : I Tried Their Viral Peel-off Mask,Point of Yu,https://www.youtube.com/watch?v=vUblA8O08oQ
UgyR8d1_68H0hwauYsl4AaABAg,vUblA8O08oQ,@schnukii77,"korean one is ALOT more expensive than the Japanese one, if your looking for an affordable one choose the Japanese one",11,2025-10-04T01:39:44Z,0,K-Beauty vs J-Beauty : I Tried Their Viral Peel-off Mask,Point of Yu,https://www.youtube.com/watch?v=vUblA8O08oQ
UgzyA0fVMks4cfRvnIl4AaABAg,vUblA8O08oQ,@MoMo-ee9zs,Please keep this series up! 🙏❤,12,2025-10-03T13:49:50Z,1,K-Beauty vs J-Beauty : I Tried Their Viral Peel-off Mask,Point of Yu,https://www.youtube.com/watch?v=vUblA8O08oQ
Ugw7vQcM_qAh-IK5qL94AaABAg,vUblA8O08oQ,@minene6649,"In Japan, the Curel brand is for sensitive skin. Products for sensitive skin are clearly labeled as such. Due to strict pharmaceutical regulations, Japanese products should be better for sensitive skin. If effectiveness is your priority, Korean products are the best choice.",0,2025-11-03T07:56:52Z,0,K-Beauty vs J-Beauty : I Tried Their Viral Peel-off Mask,Point of Yu,https://www.youtube.com/watch?v=vUblA8O08oQ
UgyoydadSKzmSa8YAgh4AaABAg,vUblA8O08oQ,@c0c0banks,both💞💖,9,2025-10-02T16:58:48Z,1,K-Beauty vs J-Beauty : I Tried Their Viral Peel-off Mask,Point of Yu,https://www.youtube.com/watch?v=vUblA8O08oQ
